review_id,review_title,review_date,review_rating,review_content,review_location;
"64c0fbbcc2b0639aeaba956a,""Undelivered , unfunctionally damaged, wont refund - i have made an order paid for it"",2023-07-26,1,""I have made an order paid for it. And yet it keeps saying shipped and never shipped. Tracking keeps saying cant find shipment. It arrived in the end. Its.damaged to the point of not possiable to assemble fully. They wont refund full for unuseable product. Add insult to injury. The ceo owner is arrogant, the staff rude, aggressive, wont assist will offer variouse vouchers of 70, 100 etc. But not refund. I ordered a new item, i should.be able to assemble and use. Which it was not possiable. They discard item. So we did i have.email than say u are using partial which we are not. They going down hill. It was 14 damages in total on item 3 in places where it has to join another making it impossiable.My advice to everyone. Do not buy fron them. Google. Many shoppers are suffering. And they not taking responsibility. It worth risk losing your money. Is worth the hassle. Go to another distributor. They are not worth the risk."",GB";
"64c74d8670c6a2f2d84b749c,Feels like a scam,2023-07-25,1,""Feels like a scam, ordered product on basis 1-3 day delivery in UK, invoice stated the same. Tracking comes through after 24 hours, product in Poland and will be 7-10 working days. Raised this with expondo, they say its incorrect on the website and if I don't want it refuse delivery. Other items still advertised the same on website. Normally wouldn't be that bothered but needed item for birthday present and they really don't seem that bothered about customer service. Very dissapointed."",GB";
"64c577884162de163a42e44d,Perfekt Product dilivery,2023-07-25,4,""Sligthly later delivery than announced. Product perfekt, value for money okay. The deliverer put the goods in front of the house without contakt. Thatcher wasn't okay."",DE";
"64bf9ee55084d7d95bb5e917,Zero stars,2023-07-24,1,""Ordered yesterday, no email confirmation.  Tried to contact, no contact information, tried on Facebook, no reply !!!Scam site....AndNow they complain they want more information about this review ??Asking for a invoice number ..Well I would give you it if you sent me a receipt for my £164.00 purchase..UPDATE 28/07Tried to call number doesn't work no way of finding out my order number as signed out as a guest ,now going through bank for a charge backSTAY AWAY FROM THIS SCAM SITE"",GB";
64bac496b20a156b25c5ea20,Value,2023-07-21,5,Value for money,GB;
64b814d0339bc1ec317b2e2e,Great value for good quality products,2023-07-19,5,,GB;
64c0c4ea58b5d5991cb056ad,NOT TRUSTWORTHY part 1 and 2,2023-07-14,1,ordered a product on 14 july paid by credit card but says product not yet shipped ..on site said shipping on day of payment ..tried to contact get only computer response trying by phone no luck...I DONT RECOMEND YOU BUY FROM THIS SITE!!!!!!!!!!!!!! Just got an email saying my problem has been resolved no explanation but tracking still says product still not shipped !!!! No direct reply form anybody there...WHAT A JOKE COMPANY!!!!!!,CH;
"64be5616193834b23798a56c,We ordered a filling machine which came…,2023-07-14,1,""We ordered a filling machine which came without an essential part. Expondo are no longer contactable on 01633 373642, the recorded announcement states the line “is down”, no alternative numbers or emails are given on the website.We are stuck with a piece of equipment we cannot use and no way of getting in touch with the supplier.Terrible customer service. Have they gone bust?!"",GB";
"64aef104b2190187604fe0f3,Buying,2023-07-12,1,""Buying, no problem.Service, warranty? Not existing."",NO";
"64ad4a1efd03e89683497014,Very reliable supplier,2023-07-11,5,""Very reliable supplier, I’ve used them a number times over the last 2 years and I’m happy with the process, their products and their customer service."",GB";
64a7f571cf0f7e9bed5f38a3,Excellent customer service 100%th from…,2023-07-07,5,Excellent customer service both from Expondo and from UPS . GREAT communication every day via email to track our parcel. We will definitely recommend purchasing from Expondo to our friends !,ES;
649eee47c2187c7aff8ed843,TERRIBLE EXPERIENCE,2023-06-30,1,TERRIBLE EXPERIENCENEVER RECEIVED ITEM OR REFUNDABSOLUTELY AVOID,IT;
6499a675ecd8bf646c7fa812,Good easy site to use but do not order…,2023-06-26,2,Good easy site to use but do not order big ticket items on COD this site wasted a week of my time by allowing me to select this as an option for purchase and when I checked my order it got cancelled rang them and they said no COD but offered on siteWaste of time,IE;
6493613cbfc2466b3cf82235,Excellent product & it's performance…,2023-06-20,5,Excellent product & it's performance bit noisy though. Overall satisfying.,GB;
64900408c25232f94dcf9169,Delivery on time and product as…,2023-06-19,5,Delivery on time and product as described,IT;
648c55ddef842cf9456bbfb5,Very easy to deal with,2023-06-15,5,Very easy to deal with had no trouble with purchasing or delivery. All arrived in perfect condition and very fast,IE;
"648d99ac69163fec0337d0c3,Wine cooler Royal Catering,2023-06-15,5,""Wine cooler which I wanted (Royal Catering 428 l).Delivery fast (just 2 days, which is great).Everything was okey."",CZ";
6489ae346964ca2778215459,great prices and fast delivery,2023-06-14,5,,IE;
6483362f706f837cb1fb4c6a,Very good concern and fast problem…,2023-06-08,5,Very good concern and fast problem solving to answer my question. They after service us trustable.,DE;
648df1c7706f837cb100c81d,Very satisfied thnx,2023-06-07,5,,CZ;
"647f6675e4a053a5b5c1b893,Waste of money and time,2023-06-06,1,""Ordered a doughnut machine £1,800. Product never left Poland and we have been refused a refund as they are saying they tried to deliver it. Shocking company and trading standards have been contacted.Employee spoken to : Horváth Àron"",GB";
64831ef9706f837cb1fb3adf,Good good jii,2023-06-04,5,,GB;
"6489b889706f837cb1fe8453,Delighted with camping fridge,2023-06-02,5,""Delighted with camping fridgeIt works well, is quiet and does not seem to run the car battery down too much. Very happy with this."",IE";
"647dce8fb62d7a9fe6b3b866,Complaint,2023-06-02,1,""""""On Friday, May 2, 2023, we received a shipment (pizza oven) from you, order number 3002877, invoice number SK-10339.The invoice does not include our VAT identification number: SK2020477613.VAT in the amount of EUR 67.33 was incorrectly added to the price. We request a correction of the invoice and settlement of the difference.The package arrived in a damaged condition, for which we have a proof from the GLS courier. However, the device appeared visually undamaged, and its functionality will be tested during this week."""""",SK";
647e06bb6f210b77115d848f,Fast and relyable delivery for a fair…,2023-06-02,5,Fast and relyable delivery for a fair price and of coarse reasonable prices and a good product quality.,DE;
647dd2c5186825050de182a2,the bag is too small,2023-06-01,1,the bag is too small. not the correct measure. worthless,PT;
"6481c87b7eb8764980d07d95,""Broken products,Terrible customer support"",2023-06-01,1,""Terrible customer support, they send me a broken hotdog steamer with loose wire and ask me to fix the problem. Cheap products, bad quality!!! Avoid if possible"",GB";
"64770c94073791baeeb8d6b5,DO NOT ORDER FROM THIS SCAM COMPANY,2023-05-31,1,""Do not order from this website, they sent me a faulty product, a barber chair that I paid over €600 for. It is unusable and I have now sent three emails to rectify the problem and no response. Do yourself a favour, DO NOT ORDER FROM THIS SCAM COMPANY."",IE";
