review_id,review_title,review_date,review_rating,review_content,review_location;
"65aed6b600af4883acaf8caf,""TIG (WIG) welder, model S-WIGMA 200PDC"",2024-01-22,5,""I ordered a TIG (WIG) / MMA welder, model S-WIGMA 200PDC.1. Shipment to Austria was very quick, tracking and delivery by GLS perfect2. The Welding DeviceFirst welding tests with stick electrodes (MMA) were fine, ignition, arc stable.I measured the current with a Fluke clamp on meter and checked the deviation. At 100 and 110 Ampere the measured current was almost exactly the adjusted one.At lower current like 50 and 55 Ampere the measured current was slightly lower (~ 3 Amps).I think that's pretty good for such a nonprofessional device.No tests with TIG (WIG) welding so far, but planned for near future...3. Customer supportI had a few questions - prompt response, polite.But one thing I have to mention:An answer to a specific question was not correct:They said the plug has a 13 mm socket. After I received the device, I measured and it turned out it is a 9mm socket.Summary: a nice welder with advanced features and adjustments like pulse frequency, Hot start, Arc Force, etc. for a reasonable price."",AT";
65a68b82126d92f1f9a4d330,Awesome experience,2024-01-15,5,Awesome experience. We had to use their customer support to fix our invoice data and they provided outstanding timing and support!,BG;
65a3c4680208eaa47b381c4d,The product arrived on time all the…,2024-01-12,5,The product arrived on time all the assembly details were perfect made it very handy and clear great service well done,IE;
"659fcc8b2e14391e7d9d5597,Good and fast delivery,2023-12-27,5,""Good and fast delivery of this amazing standing desk system, it was quite fast at very good price."",CZ";
659e780423cb48162da0eabb,Bad invoice cross-border purchase - no contact to solve,2023-12-26,1,Bad invoice - DPH on invoice - shipping to slovakia - no cantact on website to solve this problem,SK;
"65abc2180b73dff764578178,i ordered a beauty therapy trolley,2023-12-23,1,""i ordered a beauty therapy trolleyi ordered a beauty therapy trolley, item arrived in perished packaging, item was clearly used and returned, had rusty feet, broken castors, missing plastic trim, whole item was dirty and scratched, customer service said i had to source my own replacement packaging as original had perished. customer service offered me 20% discount or i could return the dirty, broken trolley, customer service sent me an evri label, had to try 4 shops before my parcel was accepted, drop off shops said parcel was too big for the type of return label issued ???still in the process of getting replacement item/refund. disgusting customer service experience, will not buy from then again, dr hasan emzi skin clinic manchester. undoubtedly there will be an expondo customer service response to this review claiming it is false and i have """"got things wrong"""" do not trust them, order from expondo at your peril!update 9/1/24 - beacuse expondo used the cheapest return method possible, the return is still in transit ????? useless. i posted it on 23/12/23update 13/1/24expondo have still not received the return ???[from tracking page]It's bookedWe've got it15:47 - Sat Dec 23We've received your parcel at the ParcelShop and we'll be collecting it shortly13:26 - Wed Dec 27We've tried to collect this parcel but it's too large for this courier. Please contact the retailer to book with our Specialist Evri couriers13:36 - Fri Dec 29maybe they should sort out the returns methodexpondo refusing to refund or replaceas far as i am concerned this is thefti will report to trading standards and credit card company.disgusting company - avoid.Date of experience: 23 December 2023"",GB";
"65830d582df3bc042399e13d,Super fast shopping,2023-12-20,5,""Super fast shopping, I found my product quickly, no problems. all information I needed about technical parameters was available, so no need to get in touch with virtual assistant. I like this store."",PL";
"6582db9ab65fe5974bf373c3,Fast service and good price-quality ratio.,2023-12-20,5,""I had some specific questions about a product, which were promptly and adequately addressed. Additionally, the price-quality ratio is very favorable!"",NL";
656f73d9d4c5be75b05e05d8,Excellent company to deal with,2023-12-04,5,Excellent company to deal with. I was nervous because the item was very large. Excellent communication and trusted shipping company used to delivery. Very competitive prices,IE;
"65950136507439cdcbfaf53b,I bought a product from Expondo,2023-12-01,4,""I bought a product from Expondo, but it was not as described. I made a complain and they came with a solution that I am satisfied with. Thank you Expondo. Thumbs up ☺️"",NO";
"656c8e019fb6285b8404c99b,ordered and recieved a honey extractor,2023-12-01,1,""ordered and recieved a honey extractor, the central basket/drum had not been properly made and it is impossible to use, we then found that Expondo has no contact details online and no email, so it is impossible to contact them, or send images.It is the 3rd item we have bought, we will not buy another, it will be interesting to raise a small claims action.DONT buy from companies without contact details!"",GB";
"6569f3461696b511eb400570,all good,2023-11-30,5,""all good, very good service, did multiply orders."",DE";
656519d49f0e1aa309f0bde4,I bought a water distiller to be fair…,2023-11-24,1,I bought a water distiller to be fair item arrived on time no broken my problem was the instructions manual it was useless I had no clear pics or instructions on how to set up. Also the pump they provided did not come with Uk plug. They were quick to respond to my email but just sent a copy of the manuel that come with it so no good. I’m now in the process of returnin Item but not been easy they said to drop it at an automated post box thing. Qr code was not expected. I then rang helpline that machine provided I was told that the item is not supposed to be returned via machine. The courier they use is Hermes and apparently I can take the QR code provided into shop to be picked up. I just hope they will pay full refund without getting bank involved.,GB;
"656312df732fe33f1a684dab,Terrible service,2023-11-23,1,""Terrible service, little professionalism, practically zero customer service. Terrible service, a huge joke!!"",IT";
655c9f3359537c12a5f6bbf7,The support service was first class excellent company,2023-11-21,5,The support service was first class. Exce,ES;
6559dbbafd28fa24bc16befd,Reliable products,2023-11-17,4,Product as described,GR;
"6559fea12c6fa03e0ffdb686,Fast,2023-11-16,5,""Fast, accurate, good product"",HU";
"6555f1cb97495601958a13fb,Great service,2023-11-16,5,""Great service, they are very kind and they answer very quick."",ES";
6557c376c95e1deebf6611b0,fast delivery and great service,2023-11-16,5,,GB;
65566b9fe70fa4225afdadc2,Value for money,2023-11-15,5,Value for money.  Free delivery,IE;
6554e6613b86e340bb2184b1,impeccable,2023-11-14,5,,CH;
654f42d74c7a0158825c7c83,Very good excellent quick delivery 🚚😁…,2023-11-11,5,Very good excellent quick delivery 🚚😁 thank you,IE;
6555b9c001457a8a4311f024,All good ..,2023-11-10,5,All good ... Thanks,GB;
6549578a7fa4b5595f1a694b,Delivery bad!,2023-11-06,1,,AT;
654b62a16991c733242c0631,Quality cooking supplies can be…,2023-11-06,5,Quality cooking supplies can be purchased here. However. The shipment speed should be improved.,NL;
"65532f82a219859d600daf37,Released by customs not got any further,2023-11-04,3,""Edit: Product finally came after contacting the through Facebook. Happy with what we finally received, but probably won’t use these again due to shipping problems.The product I ordered was released by customs since 8/11/2023 but hasn’t got any further, can’t find anywhere to contact company to chase it up"",GB";
"6546ab203b4e9ca546b4746d,welding mashine,2023-11-04,5,""Thank you, I received the welding machine.I recommend the company."",IE";
653ab154532aa794360b78f7,Great product and delivered as promised,2023-10-26,5,,GB;
6538cba967487260dd1916db,Can anyone find a customer service…,2023-10-25,1,Can anyone find a customer service contact number.not clear on website . I have purchased an item which I didn't know needed shipping and now it's hold at FedEx with shipping and holding charges. It's now been two weeks and nothing from the company. Once I receive this item I'll review again I've tried Facebook and Instagram but not got back to me.,GB;
653887e64a3807cb02531bb6,Great company to deal with and the pump…,2023-10-25,5,Great company to deal with and the pump I bought is fantastic pump for house in Africa,GB;
"653e58889557a2d6bc874db1,I ordered an item but the shipping…,2023-10-25,5,""I ordered an item but the shipping company was awful.However, I emailed expondo.com, and the problem was resolved overnight. Will order again from Expondo"",RO";
653d51baab51b38e51604008,Good product and very good service,2023-10-24,5,,GB;
"6538024e5a9c2f97df2ddf72,the balance is perfectly accurate.,2023-10-23,5,""After the callibration, the balance is perfectly accurate.I believe it will stay so accurate for a longer period of time."",HR";
"653f9b34cd60ce15187515c7,Very good quality- price ratio,2023-10-19,5,""Product on web-site looks exactly the same as is delivered. Very good quality- price ratio. Quick delivery, easy to assemble"",CH";
652e2ffe45bd43942f08af3b,Great!Thank your very much!,2023-10-17,5,,IE;
652e99faede3c53f556a3588,Quick and accurate delivery,2023-10-16,5,Quick and accurate delivery. Reasonable price,GB;
"652ac5dd69c58718a0690202,""Pot ordered, returned and still no refund 7 weeks later"",2023-10-14,1,""I paid for this product on the 9th of August. The pot was delivered to me on the 22nd of August and I effected a return on the same day. This was due to the website indicating that the product would have been delivered between 1-3 days. I received it over 2 weeks later. I didn't need the pot by then, as I had needed it for the 11th of August.I queried my refund several times since then to receive feedback stating """"we will continue to monitor this return and can refund you as soon as I get confirmation from our UK return centre. Rest assured, we are checking daily for the status of the parcel"""" - seriously? I am extremely disappointed as it is now over 7 weeks later, and I have still not received a refund. I have contacted them again yesterday and I still have not had a response.This is unacceptable. Their customer service is shocking."",GB";
6528467ca8782e36a9ef2239,Fast delivery/good value for money,2023-10-10,5,,RO;
"652541321855e31952a33738,I bought Iduction Cooker for £179…,2023-10-04,1,""We have returned the product to them on 12 October and they are not refunding the money, this confirms that these people are scammers. DO NOT BUY FROM THIS WEBSITE.I bought Iduction Cooker for £179 (INV500141188).Item delivered is faulty and I'm unable to contact the seller, there are no telephone or email address provided in the invoice or website.This company is a scam. I will now contact my bank to get my money returned to me."",GB";
"651ee50f5ae03db6af4d9088,reliable company and nice product (greenhouse),2023-10-04,5,""Purchase proces 'mothers milk' pleasant and easy at the same time.I bought the greenhouse.Product in general is OK.We set it on the concrete foundation so it stand very solid. Great thinks are the gutters on both side so water is kept away.One concern are quite fast rusting screws and not fully closed roof windowall in all product looks promising :)Service of Expondo is fast and reliable, after rising concern about some spare parts we get it with no problem"",PL";
651d21da886ec81436b7d836,Great service and urgent feedback from…,2023-10-04,5,Great service and urgent feedback from company. Reliable and swift to response,SE;
"651ee50f5ae03db6af4d9088,reliable company and nice product (greenhouse),2023-10-04,5,""Purchase proces 'mothers milk' pleasant and easy at the same time.I bought the greenhouse.Product in general is OK.We set it on the concrete foundation so it stand very solid. Great thinks are the gutters on both side so water is kept away.One concern are quite fast rusting screws and not fully closed roof windowall in all product looks promising :)Service of Expondo is fast and reliable, after rising concern about some spare parts we get it with no problem"",PL";
651c6d0bd04e9c105d755081,Brilliant experience,2023-10-03,5,Great experience and production communication was amazing though out the process would definitely recommend.,GB;
"65196a72ca5f20e8e7785529,Offroad winch,2023-10-01,5,""Little complaints, due to unclear Installation Guide, all have been dealt with swiftly and effectively by Expondo. Recommend the Compny."",DE";
6516a460c86310a3c68f7a38,Ease of Use,2023-09-29,5,Nice and easy to follow and quick to fill in,GB;
"6517ee277e96d0f9013c5714,Steel posts and straps,2023-09-28,5,""Ordered some stainless steelposts and straps for a new art gallery. Top notch quality product , superbly packed, swiftly delivered. I thought great value for the product quality. Could do with a little more communication - delivery turned up and it was only by chance that I was there. But bar that tiny criticism (easy to address) very good company to deal with."",GB";
"652311a3869431546e87775e,Laboratory power supply S-LS-117,2023-09-28,5,""I haven't had time to deal with the power supply yet due to other work. I did some tests and the voltage on this power supply seems pretty accurate, the current limit does its job. Parallel and serial mode work fine. This equipment has USB, serial and RJ45 connectors. The included CD contains drivers and programming software.The price of the device was very friendly. Shipping was very fast.So I like this device. I am satisfied with the purchase."",HU";
"652311a3869431546e87775e,Laboratory power supply S-LS-117,2023-09-28,5,""I haven't had time to deal with the power supply yet due to other work. I did some tests and the voltage on this power supply seems pretty accurate, the current limit does its job. Parallel and serial mode work fine. This equipment has USB, serial and RJ45 connectors. The included CD contains drivers and programming software.The price of the device was very friendly. Shipping was very fast.So I like this device. I am satisfied with the purchase."",HU";
"6517ee277e96d0f9013c5714,Steel posts and straps,2023-09-28,5,""Ordered some stainless steelposts and straps for a new art gallery. Top notch quality product , superbly packed, swiftly delivered. I thought great value for the product quality. Could do with a little more communication - delivery turned up and it was only by chance that I was there. But bar that tiny criticism (easy to address) very good company to deal with."",GB";
"6512e401d404ddce12c8f9c4,Impressive,2023-09-26,5,""Surprisingly had a decent experience after receiving faulty goods. Refunded, return arranged and gesture of goodwill too. Thanks Expondo!"",IE";
"6514925842d6b202c17bb90c,Great value,2023-09-26,5,""Great value, good quality, very promptly delivered."",GB";
"651195928a1da539cd7da187,Good quality product,2023-09-25,5,""Good quality product, service and product packaging"",GB";
651aa9cfb6f03586cb54fb76,Pitting on a stainless pot,2023-09-24,1,My stainless steel pot got pitting and customer care team sends  me a link what to do when black spots appear on steel!?!? Their products are very poor quality and produced in China then sold for a high price!!! Definitely not recommended.,IE;
650d48f25a19ff3d42535bc7,Easy to order and the product arrived…,2023-09-21,5,Easy to order and the product arrived quickly,IE;
650b32b6c6989b93db437d88,Good online shop,2023-09-20,5,Good online shop with bargain prices on their factory seconds,GB;
"6518542d4be41325de3a0bcd,Much better than expected!,2023-09-18,5,""Perfectly delivered. This machine was much better than I expected, of course I expected it to be perfect! So silent and you can slice it so thin that you can se through it! Even the hardest salami was sliced like a warm knife in butter. I really recommend this and the only thing I regret is that I didn't buy it sooner."",SE";
"6518542d4be41325de3a0bcd,Much better than expected!,2023-09-18,5,""Perfectly delivered. This machine was much better than I expected, of course I expected it to be perfect! So silent and you can slice it so thin that you can se through it! Even the hardest salami was sliced like a warm knife in butter. I really recommend this and the only thing I regret is that I didn't buy it sooner."",SE";
"65054a4c02cded1fdfd09189,The equipment was fairly priced…,2023-09-15,5,""The equipment was fairly priced compared to similar. The advert said 3 day’s delivery but it took 7 so planning the job was affected, however the saving & the equipment made me happy with the deal. 33% less than competitors. Excellent value."",GB";
650698b75119abd01f14455b,Good site and delivered as promised,2023-09-15,5,Nice trade and from order on web site until I had my package took less than a week.,DK;
"65054a4c02cded1fdfd09189,The equipment was fairly priced…,2023-09-15,5,""The equipment was fairly priced compared to similar. The advert said 3 day’s delivery but it took 7 so planning the job was affected, however the saving & the equipment made me happy with the deal. 33% less than competitors. Excellent value."",GB";
64fd6a024e011bdc9384c375,Rubbish,2023-09-10,1,Rubbish my parcel (Parcel number:65687376151) was supposed to arrive in 1-3 working days. I ordered it on Tuesday. Now it's Sunday I still haven't got it and it shows at Customs since Friday 3 a.m.,GB;
"64fc957947e509249be3217f,kitchen enthusiasm.,2023-09-09,5,""II appreciate a good service ,Im satisfied with my buying.i will user at my home kitchen . Tanks you Expondo.com. l recommend to all enthusiasm,"",NO";
"64fdadf89b2d8bb46d452b74,Very good quality product,2023-09-05,5,""Very good quality product, well packed and delivered in good time. Very satisfied."",GB";
650464f76e1c6646a2dd1597,First time buyer,2023-09-05,5,First time buyer . Very happy with the purchase very happy with the level of service and quality of after purchase service too. Always kept me informed on the tracking of the purchase and once my purchase arrived they checked up on me to make sure I was happy ….,GB;
"64f773f1bbab1ffe2e61dc09,everything was quick and professional,2023-09-05,4,""everything was ok, it was quick and professional.web shop is easy to use and gives a good description of goods."",HR";
64f4db11d6cd4776e719493b,Quick and correct delivery👍,2023-08-31,5,,DK;
64eefd034c152f4a7d6089cf,paid for 5lt water pot 18/08/23.,2023-08-30,2,paid for 5lt water pot 18/08/23.twelve days later still not received and deliverer claims that I no longer live at my address!!!All contact is in Polish! So it gets me nowhere.Do not recommend if buying from Britain,GB;
64edb5d159a1f461dd03f8ac,Fabulous pots,2023-08-29,5,Really pleased with the pots. Delivery was very quick could not fault the company. Would recommend to others.,GB;
"6511601f80fac02db8231204,Post-warranty service,2023-08-28,5,""Thanks to resourceful customer service, my RCMB-2LA blender is working properly again.Elena from expondo GmbH has become my favorite person from the company. She solved my problem quickly and efficiently. It turns out that keeping a customer after warranty is as important as getting a new one. We are staying for a long time with products from exppondo."",NL";
"6511601f80fac02db8231204,Post-warranty service,2023-08-28,5,""Thanks to resourceful customer service, my RCMB-2LA blender is working properly again.Elena from expondo GmbH has become my favorite person from the company. She solved my problem quickly and efficiently. It turns out that keeping a customer after warranty is as important as getting a new one. We are staying for a long time with products from exppondo."",NL";
64e689cbfb1204fbd8f29900,Excellent quality products and delivery…,2023-08-23,5,Excellent quality products and delivery with care ( delivery to uk is 8-14 days ) i receive my item in 8 days ;)Highly recommended,GB
64e7d9afe9bcf3c9c0695dd3,Great product arrived in very short…,2023-08-22,5,Great product arrived in very short time.,HR;
64e35173cdd8f60dd7cf934c,I'am purcased the cornflakes stora ge…,2023-08-21,5,I'am purcased the cornflakes stora ge box tank great quality very nice and usefull the webshop recomended delivery very fast everything was perfect well done.,HR;
6507047a7502847f0943ba07,Broken lab trolley,2023-08-21,1,Broken lab trolleyInstead of a lab trolley our clinic received a box with a pile of metal waste. The company cannot have been in good faith when the trolley was packed.We sent some photos of the trash we received.  We received a reply saying that we should sent some photos. That was exactly what we had just done.We waisted a lot of time dealing with the Expondos´s customer service.After many inquiries we got the money back.,DK;
6504d1c8c698dfd6d5fe6f92,Communication is easy with them…,2023-08-14,1,Communication is easy with them replying but actually getting anything done is a nightmare. A month I’ve been trying to have a product returned (because of their website crashing we accidentally ordered two). Still no sign of someone collecting the one they dumped at my house that I didn’t want. Which I asked to be cancelled the day of purchase. Horrendous customer service.,GB;
64d6ab086e7a34ff1532b3bc,Great quality product and in great…,2023-08-11,5,Great quality product and in great condition. No issue with expondo although bear in mind 1-3 days delivery may apply to some items but mine came from Poland and I don't recall seeing it could take around 2 weeks which I see as acceptable but I was expecting far sooner so just bare that in mind. May also have been due to stuff like a certain country trying to take over a bordering country which may also cause delays. #furussia,GB;
64d6ab086e7a34ff1532b3bc,Great quality product and in great…,2023-08-11,5,Great quality product and in great condition. No issue with expondo although bear in mind 1-3 days delivery may apply to some items but mine came from Poland and I don't recall seeing it could take around 2 weeks which I see as acceptable but I was expecting far sooner so just bare that in mind. May also have been due to stuff like a certain country trying to take over a bordering country which may also cause delays. #furussia,GB;
64d38d0411e93d384055f33e,a trustworthy professional company,2023-08-09,4,a trustworthy professional companythey need to improve their customer communication.specifically they need acknowledge the order fast (less than 12 hours) via email and to mention possible delivery dates,GB;
64d2b188b4e88f57d68da4b8,Excellent product at a good price,2023-08-08,5,,GB;
64cf60dbdda4069ee0f0a6e8,Highly recommended,2023-08-06,5,I'm excited about that part. Good quality and best workmanship. The price-performance ratio is right.,DE;
64cd23fd26096e36f1a7cb6e,It’s a scam website and company,2023-08-04,1,It’s a scam website and company. They have no contact number or email on their website. Their website says delivery in 1-3 days but it’s taking 2-3 weeks. Complete SCAM! Don’t order from them.,PK;
"64ca794a2910a3174a272877,Good will not arrive on time  as promised,2023-08-02,3,""The reason I gave them 3 stars was not a flaw in the product but false advertising ,, it said 1/3 day’s estimated deliver it took almost 2 weeks ,, I needed for a party so I was disappointed,, also there is no email or telephone number to contact them ,, needs to be more professional"",IE";
64dfa578cdcc75c3ca72308e,No way to contact expondo.ch,2023-08-01,1,No way to contact expondo.chItem was paid and not shipped for 3 weeks.no phone number email etc.,CH;
64d09f5e4a749a4fef2ae27d,Very good product availability and…,2023-07-31,5,Very good product availability and excellent prices.The delivery was fast and the parcel was well packed.I would definitely reorder on this site.,FR;
64c9223d656a964ada6f4c3c,Delivery was as quick as it could be…,2023-07-29,5,Delivery was as quick as it could be seeing it was coming from abroad,GB;
64c3747b3a0b9d16a92f3651,Spam like hell,2023-07-28,1,,DK;
64c580265f8a6fbb3c7e2d7e,Super quick delivery and great product,2023-07-28,5,Super quick delivery and great product. Definitely not the last time I buy something from here🤩👍🏻,DK;
64d3f92b5516c9043cc1df72,Excellent customer service,2023-07-27,5,I borrowed a brand new popcorn machine for a party. It was really nice looking and had two small doors made of glass.  Unfortunately one of the doors was shattered during the party. I contacted expondo customer service to buy a new door since the machine was originally supplied by them.Chrissie from expondo was an excellent help in a somewhat difficult situation. The door was not on stock right away but Chrissie contacted me as soon as it was available and I got a new door shipped to my home at a very reasonable price. Excellent service.,DK;
64d3f92b5516c9043cc1df72,Excellent customer service,2023-07-27,5,I borrowed a brand new popcorn machine for a party. It was really nice looking and had two small doors made of glass.  Unfortunately one of the doors was shattered during the party. I contacted expondo customer service to buy a new door since the machine was originally supplied by them.Chrissie from expondo was an excellent help in a somewhat difficult situation. The door was not on stock right away but Chrissie contacted me as soon as it was available and I got a new door shipped to my home at a very reasonable price. Excellent service.,DK;
